###DEVICE;;/dev/sda;;
smartctl 7.4 2024-10-15 r5620 [x86_64-linux-6.17.4-2-pve] (local build)
Copyright (C) 2002-23, Bruce Allen, Christian Franke, www.smartmontools.org

=== START OF INFORMATION SECTION ===
Vendor:               TOSHIBA
Product:              AL14SEB030N
Revision:             5704
Compliance:           SPC-4
User Capacity:        300,000,000,000 bytes [300 GB]
Logical block size:   512 bytes
Rotation Rate:        10500 rpm
Form Factor:          2.5 inches
Logical Unit id:      0x50000397b85235d1
Serial number:        47S0A01RF8KC
Device type:          disk
Transport protocol:   SAS (SPL-4)
Local Time is:        Wed Apr 15 18:45:48 2026 CEST
SMART support is:     Available - device has SMART capability.
SMART support is:     Enabled
Temperature Warning:  Enabled

=== START OF READ SMART DATA SECTION ===
SMART Health Status: OK

Current Drive Temperature:     28 C
Drive Trip Temperature:        65 C

Accumulated power on time, hours:minutes 71429:05
Manufactured in week 17 of year 2017
Specified cycle count over device lifetime:  50000
Accumulated start-stop cycles:  23
Specified load-unload count over device lifetime:  600000
Accumulated load-unload cycles:  23
Elements in grown defect list: 0

Error counter log:
           Errors Corrected by           Total   Correction     Gigabytes    Total
               ECC          rereads/    errors   algorithm      processed    uncorrected
           fast | delayed   rewrites  corrected  invocations   [10^9 bytes]  errors
read:          0    12701         0         0          0    1156002.147           0
write:         0        0         0         0          0     433045.507           0

Non-medium error count:       24

SMART Self-test log
Num  Test              Status                 segment  LifeTime  LBA_first_err [SK ASC ASQ]
     Description                              number   (hours)
# 1  Background short  Completed                   -   65535                 - [-   -    -]
# 2  Background short  Completed                   -   65535                 - [-   -    -]
# 3  Background short  Completed                   -   65535                 - [-   -    -]
# 4  Background short  Completed                   -   65535                 - [-   -    -]
# 5  Background short  Completed                   -   65535                 - [-   -    -]
# 6  Background short  Completed                   -   65535                 - [-   -    -]
# 7  Background short  Completed                   -   65535                 - [-   -    -]
# 8  Background short  Completed                   -   65535                 - [-   -    -]
# 9  Background short  Completed                   -   65535                 - [-   -    -]
#10  Background short  Completed                   -   65535                 - [-   -    -]
#11  Background short  Completed                   -   65535                 - [-   -    -]
#12  Background short  Completed                   -   65535                 - [-   -    -]
#13  Background short  Completed                   -   65535                 - [-   -    -]
#14  Background short  Completed                   -   65535                 - [-   -    -]
#15  Background short  Completed                   -   65535                 - [-   -    -]
#16  Background short  Completed                   -   65535                 - [-   -    -]
#17  Background short  Completed                   -   65535                 - [-   -    -]
#18  Background short  Completed                   -   65535                 - [-   -    -]
#19  Background short  Completed                   -   65535                 - [-   -    -]
#20  Background short  Completed                   -   65535                 - [-   -    -]

Long (extended) Self-test duration: 2487 seconds [41.5 minutes]

###ENDDEVICE
###DEVICE;;/dev/sdb;;-d sat
smartctl 7.4 2024-10-15 r5620 [x86_64-linux-6.17.4-2-pve] (local build)
Copyright (C) 2002-23, Bruce Allen, Christian Franke, www.smartmontools.org

=== START OF INFORMATION SECTION ===
Model Family:     Samsung based SSDs
Device Model:     SAMSUNG MZ7LM960HMJP-00003
Serial Number:    S3LHNX0J800021
LU WWN Device Id: 5 002538 c40769d64
Firmware Version: GXT50F3Q
User Capacity:    960,197,124,096 bytes [960 GB]
Sector Size:      512 bytes logical/physical
Rotation Rate:    Solid State Device
Form Factor:      2.5 inches
TRIM Command:     Available, deterministic, zeroed
Device is:        In smartctl database 7.3/5528
ATA Version is:   ACS-2, ATA8-ACS T13/1699-D revision 4c
SATA Version is:  SATA 3.1, 6.0 Gb/s (current: 6.0 Gb/s)
Local Time is:    Wed Apr 15 18:45:48 2026 CEST
SMART support is: Available - device has SMART capability.
SMART support is: Enabled

=== START OF READ SMART DATA SECTION ===
SMART overall-health self-assessment test result: PASSED

General SMART Values:
Offline data collection status:  (0x82)	Offline data collection activity
					was completed without error.
					Auto Offline Data Collection: Enabled.
Self-test execution status:      (   0)	The previous self-test routine completed
					without error or no self-test has ever 
					been run.
Total time to complete Offline 
data collection: 		( 3600) seconds.
Offline data collection
capabilities: 			 (0x53) SMART execute Offline immediate.
					Auto Offline data collection on/off support.
					Suspend Offline collection upon new
					command.
					No Offline surface scan supported.
					Self-test supported.
					No Conveyance Self-test supported.
					Selective Self-test supported.
SMART capabilities:            (0x0003)	Saves SMART data before entering
					power-saving mode.
					Supports SMART auto save timer.
Error logging capability:        (0x01)	Error logging supported.
					General Purpose Logging supported.
Short self-test routine 
recommended polling time: 	 (   2) minutes.
Extended self-test routine
recommended polling time: 	 (  60) minutes.
SCT capabilities: 	       (0x003d)	SCT Status supported.
					SCT Error Recovery Control supported.
					SCT Feature Control supported.
					SCT Data Table supported.

SMART Attributes Data Structure revision number: 1
Vendor Specific SMART Attributes with Thresholds:
ID# ATTRIBUTE_NAME          FLAG     VALUE WORST THRESH TYPE      UPDATED  WHEN_FAILED RAW_VALUE
  5 Reallocated_Sector_Ct   0x0033   100   100   010    Pre-fail  Always       -       0
  9 Power_On_Hours          0x0032   085   085   000    Old_age   Always       -       71431
 12 Power_Cycle_Count       0x0032   099   099   000    Old_age   Always       -       25
177 Wear_Leveling_Count     0x0013   092   092   005    Pre-fail  Always       -       594
179 Used_Rsvd_Blk_Cnt_Tot   0x0013   100   100   010    Pre-fail  Always       -       0
180 Unused_Rsvd_Blk_Cnt_Tot 0x0013   100   100   010    Pre-fail  Always       -       3301
181 Program_Fail_Cnt_Total  0x0032   100   100   010    Old_age   Always       -       0
182 Erase_Fail_Count_Total  0x0032   100   100   010    Old_age   Always       -       0
183 Runtime_Bad_Block       0x0013   100   100   010    Pre-fail  Always       -       0
184 End-to-End_Error        0x0033   100   100   097    Pre-fail  Always       -       0
187 Uncorrectable_Error_Cnt 0x0032   100   100   000    Old_age   Always       -       0
190 Airflow_Temperature_Cel 0x0032   066   041   000    Old_age   Always       -       34
194 Temperature_Celsius     0x0022   066   041   000    Old_age   Always       -       34 (Min/Max 20/59)
195 ECC_Error_Rate          0x001a   200   200   000    Old_age   Always       -       0
197 Current_Pending_Sector  0x0032   100   100   000    Old_age   Always       -       0
199 CRC_Error_Count         0x003e   100   100   000    Old_age   Always       -       0
202 Exception_Mode_Status   0x0033   100   100   010    Pre-fail  Always       -       0
235 POR_Recovery_Count      0x0012   099   099   000    Old_age   Always       -       9
241 Total_LBAs_Written      0x0032   099   099   000    Old_age   Always       -       516518579829
242 Total_LBAs_Read         0x0032   099   099   000    Old_age   Always       -       635205957482
243 SATA_Downshift_Ct       0x0032   100   100   000    Old_age   Always       -       0
244 Thermal_Throttle_St     0x0032   100   100   000    Old_age   Always       -       0
245 Timed_Workld_Media_Wear 0x0032   100   100   000    Old_age   Always       -       65535
246 Timed_Workld_RdWr_Ratio 0x0032   100   100   000    Old_age   Always       -       65535
247 Timed_Workld_Timer      0x0032   100   100   000    Old_age   Always       -       65535
251 NAND_Writes             0x0032   100   100   000    Old_age   Always       -       1271526868992

SMART Error Log Version: 1
No Errors Logged

SMART Self-test log structure revision number 1
Num  Test_Description    Status                  Remaining  LifeTime(hours)  LBA_of_first_error
# 1  Short offline       Completed without error       00%      5878         -
# 2  Short offline       Completed without error       00%      5854         -
# 3  Short offline       Completed without error       00%      5830         -
# 4  Short offline       Completed without error       00%      5806         -
# 5  Short offline       Completed without error       00%      5782         -
# 6  Short offline       Completed without error       00%      5758         -
# 7  Short offline       Completed without error       00%      5734         -
# 8  Short offline       Completed without error       00%      5710         -
# 9  Short offline       Completed without error       00%      5686         -
#10  Short offline       Completed without error       00%      5662         -
#11  Short offline       Completed without error       00%      5638         -
#12  Short offline       Completed without error       00%      5614         -
#13  Short offline       Completed without error       00%      5590         -
#14  Short offline       Completed without error       00%      5566         -
#15  Short offline       Completed without error       00%      5542         -
#16  Short offline       Completed without error       00%      5518         -
#17  Short offline       Completed without error       00%      5494         -
#18  Short offline       Completed without error       00%      5447         -
#19  Short offline       Completed without error       00%      5423         -
#20  Short offline       Completed without error       00%      5399         -
#21  Short offline       Completed without error       00%      5375         -

SMART Selective self-test log data structure revision number 1
 SPAN  MIN_LBA  MAX_LBA  CURRENT_TEST_STATUS
    1        0        0  Not_testing
    2        0        0  Not_testing
    3        0        0  Not_testing
    4        0        0  Not_testing
    5        0        0  Not_testing
  255        0    65535  Read_scanning was completed without error
Selective self-test flags (0x0):
  After scanning selected spans, do NOT read-scan remainder of disk.
If Selective self-test is pending on power-up, resume after 0 minute delay.

The above only provides legacy SMART information - try 'smartctl -x' for more

###ENDDEVICE
###DEVICE;;/dev/sdc;;-d sat
smartctl 7.4 2024-10-15 r5620 [x86_64-linux-6.17.4-2-pve] (local build)
Copyright (C) 2002-23, Bruce Allen, Christian Franke, www.smartmontools.org

=== START OF INFORMATION SECTION ===
Model Family:     Samsung based SSDs
Device Model:     SAMSUNG MZ7LM960HMJP-00003
Serial Number:    S3LHNX0J800024
LU WWN Device Id: 5 002538 c40769d67
Firmware Version: GXT50F3Q
User Capacity:    960,197,124,096 bytes [960 GB]
Sector Size:      512 bytes logical/physical
Rotation Rate:    Solid State Device
Form Factor:      2.5 inches
TRIM Command:     Available, deterministic, zeroed
Device is:        In smartctl database 7.3/5528
ATA Version is:   ACS-2, ATA8-ACS T13/1699-D revision 4c
SATA Version is:  SATA 3.1, 6.0 Gb/s (current: 6.0 Gb/s)
Local Time is:    Wed Apr 15 18:45:48 2026 CEST
SMART support is: Available - device has SMART capability.
SMART support is: Enabled

=== START OF READ SMART DATA SECTION ===
SMART overall-health self-assessment test result: PASSED

General SMART Values:
Offline data collection status:  (0x82)	Offline data collection activity
					was completed without error.
					Auto Offline Data Collection: Enabled.
Self-test execution status:      (   0)	The previous self-test routine completed
					without error or no self-test has ever 
					been run.
Total time to complete Offline 
data collection: 		( 3600) seconds.
Offline data collection
capabilities: 			 (0x53) SMART execute Offline immediate.
					Auto Offline data collection on/off support.
					Suspend Offline collection upon new
					command.
					No Offline surface scan supported.
					Self-test supported.
					No Conveyance Self-test supported.
					Selective Self-test supported.
SMART capabilities:            (0x0003)	Saves SMART data before entering
					power-saving mode.
					Supports SMART auto save timer.
Error logging capability:        (0x01)	Error logging supported.
					General Purpose Logging supported.
Short self-test routine 
recommended polling time: 	 (   2) minutes.
Extended self-test routine
recommended polling time: 	 (  60) minutes.
SCT capabilities: 	       (0x003d)	SCT Status supported.
					SCT Error Recovery Control supported.
					SCT Feature Control supported.
					SCT Data Table supported.

SMART Attributes Data Structure revision number: 1
Vendor Specific SMART Attributes with Thresholds:
ID# ATTRIBUTE_NAME          FLAG     VALUE WORST THRESH TYPE      UPDATED  WHEN_FAILED RAW_VALUE
  5 Reallocated_Sector_Ct   0x0033   098   098   010    Pre-fail  Always       -       64
  9 Power_On_Hours          0x0032   085   085   000    Old_age   Always       -       71431
 12 Power_Cycle_Count       0x0032   099   099   000    Old_age   Always       -       25
177 Wear_Leveling_Count     0x0013   091   091   005    Pre-fail  Always       -       601
179 Used_Rsvd_Blk_Cnt_Tot   0x0013   098   098   010    Pre-fail  Always       -       64
180 Unused_Rsvd_Blk_Cnt_Tot 0x0013   098   098   010    Pre-fail  Always       -       3170
181 Program_Fail_Cnt_Total  0x0032   100   100   010    Old_age   Always       -       0
182 Erase_Fail_Count_Total  0x0032   100   100   010    Old_age   Always       -       0
183 Runtime_Bad_Block       0x0013   098   098   010    Pre-fail  Always       -       64
184 End-to-End_Error        0x0033   100   100   097    Pre-fail  Always       -       0
187 Uncorrectable_Error_Cnt 0x0032   099   099   000    Old_age   Always       -       26
190 Airflow_Temperature_Cel 0x0032   066   041   000    Old_age   Always       -       34
194 Temperature_Celsius     0x0022   066   041   000    Old_age   Always       -       34 (Min/Max 22/59)
195 ECC_Error_Rate          0x001a   199   199   000    Old_age   Always       -       26
197 Current_Pending_Sector  0x0032   100   100   000    Old_age   Always       -       0
199 CRC_Error_Count         0x003e   100   100   000    Old_age   Always       -       0
202 Exception_Mode_Status   0x0033   100   100   010    Pre-fail  Always       -       0
235 POR_Recovery_Count      0x0012   099   099   000    Old_age   Always       -       9
241 Total_LBAs_Written      0x0032   099   099   000    Old_age   Always       -       514350837441
242 Total_LBAs_Read         0x0032   099   099   000    Old_age   Always       -       610874474599
243 SATA_Downshift_Ct       0x0032   100   100   000    Old_age   Always       -       0
244 Thermal_Throttle_St     0x0032   100   100   000    Old_age   Always       -       0
245 Timed_Workld_Media_Wear 0x0032   100   100   000    Old_age   Always       -       65535
246 Timed_Workld_RdWr_Ratio 0x0032   100   100   000    Old_age   Always       -       65535
247 Timed_Workld_Timer      0x0032   100   100   000    Old_age   Always       -       65535
251 NAND_Writes             0x0032   100   100   000    Old_age   Always       -       1286582774784

SMART Error Log Version: 1
ATA Error Count: 26 (device log contains only the most recent five errors)
	CR = Command Register [HEX]
	FR = Features Register [HEX]
	SC = Sector Count Register [HEX]
	SN = Sector Number Register [HEX]
	CL = Cylinder Low Register [HEX]
	CH = Cylinder High Register [HEX]
	DH = Device/Head Register [HEX]
	DC = Device Command Register [HEX]
	ER = Error register [HEX]
	ST = Status register [HEX]
Powered_Up_Time is measured from power on, and printed as
DDd+hh:mm:SS.sss where DD=days, hh=hours, mm=minutes,
SS=sec, and sss=millisec. It "wraps" after 49.710 days.

Error 26 occurred at disk power-on lifetime: 56900 hours (2370 days + 20 hours)
  When the command that caused the error occurred, the device was active or idle.

  After command completion occurred, registers were:
  ER ST SC SN CL CH DH
  -- -- -- -- -- -- --
  00 51 01 10 00 00 00  Error:  at LBA = 0x00000010 = 16

  Commands leading to the command that caused the error were:
  CR FR SC SN CL CH DH DC   Powered_Up_Time  Command/Feature_Name
  -- -- -- -- -- -- -- --  ----------------  --------------------
  60 20 50 60 b7 12 00 0a      02:13:59.256  READ FPDMA QUEUED
  60 20 48 e0 a8 71 00 09      02:13:59.256  READ FPDMA QUEUED
  60 20 40 c0 30 a7 00 08      02:13:59.256  READ FPDMA QUEUED
  60 40 38 c0 e7 08 00 07      02:13:59.256  READ FPDMA QUEUED
  60 20 30 80 f9 a3 00 06      02:13:59.256  READ FPDMA QUEUED

Error 25 occurred at disk power-on lifetime: 56900 hours (2370 days + 20 hours)
  When the command that caused the error occurred, the device was active or idle.

  After command completion occurred, registers were:
  ER ST SC SN CL CH DH
  -- -- -- -- -- -- --
  00 51 01 10 00 00 00  Error:  at LBA = 0x00000010 = 16

  Commands leading to the command that caused the error were:
  CR FR SC SN CL CH DH DC   Powered_Up_Time  Command/Feature_Name
  -- -- -- -- -- -- -- --  ----------------  --------------------
  60 20 58 e0 a8 71 00 0b      02:13:59.256  READ FPDMA QUEUED
  60 20 50 c0 30 a7 00 0a      02:13:59.256  READ FPDMA QUEUED
  60 40 48 c0 e7 08 00 09      02:13:59.256  READ FPDMA QUEUED
  60 20 40 80 f9 a3 00 08      02:13:59.256  READ FPDMA QUEUED
  60 40 38 80 43 21 00 07      02:13:59.256  READ FPDMA QUEUED

Error 24 occurred at disk power-on lifetime: 56888 hours (2370 days + 8 hours)
  When the command that caused the error occurred, the device was active or idle.

  After command completion occurred, registers were:
  ER ST SC SN CL CH DH
  -- -- -- -- -- -- --
  00 51 01 10 00 00 00  Error:  at LBA = 0x00000010 = 16

  Commands leading to the command that caused the error were:
  CR FR SC SN CL CH DH DC   Powered_Up_Time  Command/Feature_Name
  -- -- -- -- -- -- -- --  ----------------  --------------------
  60 40 28 40 b8 12 00 05      02:13:16.763  READ FPDMA QUEUED
  60 20 20 00 27 b6 00 04      02:13:16.763  READ FPDMA QUEUED
  60 80 18 c0 30 a7 00 03      02:13:16.763  READ FPDMA QUEUED
  60 40 10 c0 e7 08 00 02      02:13:16.763  READ FPDMA QUEUED
  60 20 08 a0 0f ac 00 01      02:13:16.763  READ FPDMA QUEUED

Error 23 occurred at disk power-on lifetime: 56888 hours (2370 days + 8 hours)
  When the command that caused the error occurred, the device was active or idle.

  After command completion occurred, registers were:
  ER ST SC SN CL CH DH
  -- -- -- -- -- -- --
  00 51 01 10 00 00 00  Error:  at LBA = 0x00000010 = 16

  Commands leading to the command that caused the error were:
  CR FR SC SN CL CH DH DC   Powered_Up_Time  Command/Feature_Name
  -- -- -- -- -- -- -- --  ----------------  --------------------
  60 20 58 00 27 b6 00 0b      02:13:16.763  READ FPDMA QUEUED
  60 80 50 c0 30 a7 00 0a      02:13:16.763  READ FPDMA QUEUED
  60 40 48 c0 e7 08 00 09      02:13:16.763  READ FPDMA QUEUED
  60 20 40 a0 0f ac 00 08      02:13:16.763  READ FPDMA QUEUED
  60 20 38 80 f9 a3 00 07      02:13:16.763  READ FPDMA QUEUED

Error 22 occurred at disk power-on lifetime: 56853 hours (2368 days + 21 hours)
  When the command that caused the error occurred, the device was active or idle.

  After command completion occurred, registers were:
  ER ST SC SN CL CH DH
  -- -- -- -- -- -- --
  00 51 01 10 00 00 00  Error:  at LBA = 0x00000010 = 16

  Commands leading to the command that caused the error were:
  CR FR SC SN CL CH DH DC   Powered_Up_Time  Command/Feature_Name
  -- -- -- -- -- -- -- --  ----------------  --------------------
  60 40 28 40 b8 12 00 05      02:11:09.078  READ FPDMA QUEUED
  60 20 20 00 27 b6 00 04      02:11:09.078  READ FPDMA QUEUED
  60 80 18 c0 30 a7 00 03      02:11:09.078  READ FPDMA QUEUED
  60 40 10 c0 e7 08 00 02      02:11:09.078  READ FPDMA QUEUED
  60 20 08 a0 0f ac 00 01      02:11:09.078  READ FPDMA QUEUED

SMART Self-test log structure revision number 1
Num  Test_Description    Status                  Remaining  LifeTime(hours)  LBA_of_first_error
# 1  Short offline       Completed without error       00%      5878         -
# 2  Short offline       Completed without error       00%      5854         -
# 3  Short offline       Completed without error       00%      5830         -
# 4  Short offline       Completed without error       00%      5806         -
# 5  Short offline       Completed without error       00%      5782         -
# 6  Short offline       Completed without error       00%      5758         -
# 7  Short offline       Completed without error       00%      5734         -
# 8  Short offline       Completed without error       00%      5710         -
# 9  Short offline       Completed without error       00%      5686         -
#10  Short offline       Completed without error       00%      5662         -
#11  Short offline       Completed without error       00%      5638         -
#12  Short offline       Completed without error       00%      5614         -
#13  Short offline       Completed without error       00%      5590         -
#14  Short offline       Completed without error       00%      5566         -
#15  Short offline       Completed without error       00%      5542         -
#16  Short offline       Completed without error       00%      5518         -
#17  Short offline       Completed without error       00%      5494         -
#18  Short offline       Completed without error       00%      5447         -
#19  Short offline       Completed without error       00%      5423         -
#20  Short offline       Completed without error       00%      5399         -
#21  Short offline       Completed without error       00%      5375         -

SMART Selective self-test log data structure revision number 1
 SPAN  MIN_LBA  MAX_LBA  CURRENT_TEST_STATUS
    1        0        0  Not_testing
    2        0        0  Not_testing
    3        0        0  Not_testing
    4        0        0  Not_testing
    5        0        0  Not_testing
  255        0    65535  Read_scanning was completed without error
Selective self-test flags (0x0):
  After scanning selected spans, do NOT read-scan remainder of disk.
If Selective self-test is pending on power-up, resume after 0 minute delay.

The above only provides legacy SMART information - try 'smartctl -x' for more

###ENDDEVICE
###DEVICE;;/dev/sdd;;-d sat
smartctl 7.4 2024-10-15 r5620 [x86_64-linux-6.17.4-2-pve] (local build)
Copyright (C) 2002-23, Bruce Allen, Christian Franke, www.smartmontools.org

=== START OF INFORMATION SECTION ===
Model Family:     Samsung based SSDs
Device Model:     SAMSUNG MZ7LM960HMJP-00003
Serial Number:    S3LHNX0J800016
LU WWN Device Id: 5 002538 c40769d5f
Firmware Version: GXT50F3Q
User Capacity:    960,197,124,096 bytes [960 GB]
Sector Size:      512 bytes logical/physical
Rotation Rate:    Solid State Device
Form Factor:      2.5 inches
TRIM Command:     Available, deterministic, zeroed
Device is:        In smartctl database 7.3/5528
ATA Version is:   ACS-2, ATA8-ACS T13/1699-D revision 4c
SATA Version is:  SATA 3.1, 6.0 Gb/s (current: 6.0 Gb/s)
Local Time is:    Wed Apr 15 18:45:48 2026 CEST
SMART support is: Available - device has SMART capability.
SMART support is: Enabled

=== START OF READ SMART DATA SECTION ===
SMART overall-health self-assessment test result: PASSED

General SMART Values:
Offline data collection status:  (0x82)	Offline data collection activity
					was completed without error.
					Auto Offline Data Collection: Enabled.
Self-test execution status:      (   0)	The previous self-test routine completed
					without error or no self-test has ever 
					been run.
Total time to complete Offline 
data collection: 		( 3600) seconds.
Offline data collection
capabilities: 			 (0x53) SMART execute Offline immediate.
					Auto Offline data collection on/off support.
					Suspend Offline collection upon new
					command.
					No Offline surface scan supported.
					Self-test supported.
					No Conveyance Self-test supported.
					Selective Self-test supported.
SMART capabilities:            (0x0003)	Saves SMART data before entering
					power-saving mode.
					Supports SMART auto save timer.
Error logging capability:        (0x01)	Error logging supported.
					General Purpose Logging supported.
Short self-test routine 
recommended polling time: 	 (   2) minutes.
Extended self-test routine
recommended polling time: 	 (  60) minutes.
SCT capabilities: 	       (0x003d)	SCT Status supported.
					SCT Error Recovery Control supported.
					SCT Feature Control supported.
					SCT Data Table supported.

SMART Attributes Data Structure revision number: 1
Vendor Specific SMART Attributes with Thresholds:
ID# ATTRIBUTE_NAME          FLAG     VALUE WORST THRESH TYPE      UPDATED  WHEN_FAILED RAW_VALUE
  5 Reallocated_Sector_Ct   0x0033   097   097   010    Pre-fail  Always       -       68
  9 Power_On_Hours          0x0032   085   085   000    Old_age   Always       -       71431
 12 Power_Cycle_Count       0x0032   099   099   000    Old_age   Always       -       25
177 Wear_Leveling_Count     0x0013   092   092   005    Pre-fail  Always       -       591
179 Used_Rsvd_Blk_Cnt_Tot   0x0013   097   097   010    Pre-fail  Always       -       68
180 Unused_Rsvd_Blk_Cnt_Tot 0x0013   097   097   010    Pre-fail  Always       -       3177
181 Program_Fail_Cnt_Total  0x0032   100   100   010    Old_age   Always       -       0
182 Erase_Fail_Count_Total  0x0032   100   100   010    Old_age   Always       -       0
183 Runtime_Bad_Block       0x0013   097   097   010    Pre-fail  Always       -       68
184 End-to-End_Error        0x0033   100   100   097    Pre-fail  Always       -       0
187 Uncorrectable_Error_Cnt 0x0032   099   099   000    Old_age   Always       -       197
190 Airflow_Temperature_Cel 0x0032   067   042   000    Old_age   Always       -       33
194 Temperature_Celsius     0x0022   067   042   000    Old_age   Always       -       33 (Min/Max 20/58)
195 ECC_Error_Rate          0x001a   199   199   000    Old_age   Always       -       197
197 Current_Pending_Sector  0x0032   100   100   000    Old_age   Always       -       0
199 CRC_Error_Count         0x003e   100   100   000    Old_age   Always       -       0
202 Exception_Mode_Status   0x0033   100   100   010    Pre-fail  Always       -       0
235 POR_Recovery_Count      0x0012   099   099   000    Old_age   Always       -       9
241 Total_LBAs_Written      0x0032   099   099   000    Old_age   Always       -       521134288860
242 Total_LBAs_Read         0x0032   099   099   000    Old_age   Always       -       604256537941
243 SATA_Downshift_Ct       0x0032   100   100   000    Old_age   Always       -       0
244 Thermal_Throttle_St     0x0032   100   100   000    Old_age   Always       -       0
245 Timed_Workld_Media_Wear 0x0032   100   100   000    Old_age   Always       -       65535
246 Timed_Workld_RdWr_Ratio 0x0032   100   100   000    Old_age   Always       -       65535
247 Timed_Workld_Timer      0x0032   100   100   000    Old_age   Always       -       65535
251 NAND_Writes             0x0032   100   100   000    Old_age   Always       -       1264859017216

SMART Error Log Version: 1
ATA Error Count: 197 (device log contains only the most recent five errors)
	CR = Command Register [HEX]
	FR = Features Register [HEX]
	SC = Sector Count Register [HEX]
	SN = Sector Number Register [HEX]
	CL = Cylinder Low Register [HEX]
	CH = Cylinder High Register [HEX]
	DH = Device/Head Register [HEX]
	DC = Device Command Register [HEX]
	ER = Error register [HEX]
	ST = Status register [HEX]
Powered_Up_Time is measured from power on, and printed as
DDd+hh:mm:SS.sss where DD=days, hh=hours, mm=minutes,
SS=sec, and sss=millisec. It "wraps" after 49.710 days.

Error 197 occurred at disk power-on lifetime: 56900 hours (2370 days + 20 hours)
  When the command that caused the error occurred, the device was active or idle.

  After command completion occurred, registers were:
  ER ST SC SN CL CH DH
  -- -- -- -- -- -- --
  00 51 01 10 00 00 00  Error:  at LBA = 0x00000010 = 16

  Commands leading to the command that caused the error were:
  CR FR SC SN CL CH DH DC   Powered_Up_Time  Command/Feature_Name
  -- -- -- -- -- -- -- --  ----------------  --------------------
  60 20 c8 60 00 d1 00 19      02:13:59.318  READ FPDMA QUEUED
  60 20 c0 80 95 b6 00 18      02:13:59.318  READ FPDMA QUEUED
  60 20 b8 e0 92 3a 00 17      02:13:59.318  READ FPDMA QUEUED
  60 20 b0 00 4e 43 00 16      02:13:59.318  READ FPDMA QUEUED
  60 20 00 80 2a a6 00 00      02:13:59.318  READ FPDMA QUEUED

Error 196 occurred at disk power-on lifetime: 56900 hours (2370 days + 20 hours)
  When the command that caused the error occurred, the device was active or idle.

  After command completion occurred, registers were:
  ER ST SC SN CL CH DH
  -- -- -- -- -- -- --
  00 51 01 10 00 00 00  Error:  at LBA = 0x00000010 = 16

  Commands leading to the command that caused the error were:
  CR FR SC SN CL CH DH DC   Powered_Up_Time  Command/Feature_Name
  -- -- -- -- -- -- -- --  ----------------  --------------------
  60 20 d0 80 95 b6 00 1a      02:13:59.318  READ FPDMA QUEUED
  60 20 c8 e0 92 3a 00 19      02:13:59.318  READ FPDMA QUEUED
  60 20 c0 00 4e 43 00 18      02:13:59.318  READ FPDMA QUEUED
  60 20 b8 80 2a a6 00 17      02:13:59.318  READ FPDMA QUEUED
  60 20 b0 00 6a 70 00 16      02:13:59.318  READ FPDMA QUEUED

Error 195 occurred at disk power-on lifetime: 56900 hours (2370 days + 20 hours)
  When the command that caused the error occurred, the device was active or idle.

  After command completion occurred, registers were:
  ER ST SC SN CL CH DH
  -- -- -- -- -- -- --
  00 51 01 10 00 00 00  Error:  at LBA = 0x00000010 = 16

  Commands leading to the command that caused the error were:
  CR FR SC SN CL CH DH DC   Powered_Up_Time  Command/Feature_Name
  -- -- -- -- -- -- -- --  ----------------  --------------------
  60 20 88 c0 3d 55 00 11      02:13:59.265  READ FPDMA QUEUED
  60 20 80 c0 4f 7f 00 10      02:13:59.265  READ FPDMA QUEUED
  60 20 78 e0 2a 11 00 0f      02:13:59.265  READ FPDMA QUEUED
  60 20 70 60 25 fe 00 0e      02:13:59.265  READ FPDMA QUEUED
  60 20 68 80 5a fd 00 0d      02:13:59.265  READ FPDMA QUEUED

Error 194 occurred at disk power-on lifetime: 56900 hours (2370 days + 20 hours)
  When the command that caused the error occurred, the device was active or idle.

  After command completion occurred, registers were:
  ER ST SC SN CL CH DH
  -- -- -- -- -- -- --
  00 51 01 10 00 00 00  Error:  at LBA = 0x00000010 = 16

  Commands leading to the command that caused the error were:
  CR FR SC SN CL CH DH DC   Powered_Up_Time  Command/Feature_Name
  -- -- -- -- -- -- -- --  ----------------  --------------------
  60 20 f8 c0 4f 7f 00 1f      02:13:59.265  READ FPDMA QUEUED
  60 20 f0 e0 2a 11 00 1e      02:13:59.265  READ FPDMA QUEUED
  60 20 e8 60 25 fe 00 1d      02:13:59.265  READ FPDMA QUEUED
  60 20 e0 80 5a fd 00 1c      02:13:59.265  READ FPDMA QUEUED
  60 20 d8 40 59 fb 00 1b      02:13:59.265  READ FPDMA QUEUED

Error 193 occurred at disk power-on lifetime: 56900 hours (2370 days + 20 hours)
  When the command that caused the error occurred, the device was active or idle.

  After command completion occurred, registers were:
  ER ST SC SN CL CH DH
  -- -- -- -- -- -- --
  40 51 00 e0 ea 23 40  Error: UNC at LBA = 0x0023eae0 = 2353888

  Commands leading to the command that caused the error were:
  CR FR SC SN CL CH DH DC   Powered_Up_Time  Command/Feature_Name
  -- -- -- -- -- -- -- --  ----------------  --------------------
  60 80 00 e0 ea 23 40 00      02:13:59.211  READ FPDMA QUEUED
  2f 00 01 10 00 00 40 04      02:13:59.211  READ LOG EXT
  60 80 20 e0 ea 23 40 04      02:13:59.211  READ FPDMA QUEUED
  60 80 18 60 ec 23 40 03      02:13:59.211  READ FPDMA QUEUED
  60 80 10 80 f9 9b 40 02      02:13:59.211  READ FPDMA QUEUED

SMART Self-test log structure revision number 1
Num  Test_Description    Status                  Remaining  LifeTime(hours)  LBA_of_first_error
# 1  Short offline       Completed without error       00%      5878         -
# 2  Short offline       Completed without error       00%      5854         -
# 3  Short offline       Completed without error       00%      5830         -
# 4  Short offline       Completed without error       00%      5806         -
# 5  Short offline       Completed without error       00%      5782         -
# 6  Short offline       Completed without error       00%      5758         -
# 7  Short offline       Completed without error       00%      5734         -
# 8  Short offline       Completed without error       00%      5710         -
# 9  Short offline       Completed without error       00%      5686         -
#10  Short offline       Completed without error       00%      5662         -
#11  Short offline       Completed without error       00%      5638         -
#12  Short offline       Completed without error       00%      5614         -
#13  Short offline       Completed without error       00%      5590         -
#14  Short offline       Completed without error       00%      5566         -
#15  Short offline       Completed without error       00%      5542         -
#16  Short offline       Completed without error       00%      5518         -
#17  Short offline       Completed without error       00%      5494         -
#18  Short offline       Completed without error       00%      5447         -
#19  Short offline       Completed without error       00%      5423         -
#20  Short offline       Completed without error       00%      5399         -
#21  Short offline       Completed without error       00%      5375         -

SMART Selective self-test log data structure revision number 1
 SPAN  MIN_LBA  MAX_LBA  CURRENT_TEST_STATUS
    1        0        0  Not_testing
    2        0        0  Not_testing
    3        0        0  Not_testing
    4        0        0  Not_testing
    5        0        0  Not_testing
  255        0    65535  Read_scanning was completed without error
Selective self-test flags (0x0):
  After scanning selected spans, do NOT read-scan remainder of disk.
If Selective self-test is pending on power-up, resume after 0 minute delay.

The above only provides legacy SMART information - try 'smartctl -x' for more

###ENDDEVICE
###DEVICE;;/dev/sde;;-d sat
smartctl 7.4 2024-10-15 r5620 [x86_64-linux-6.17.4-2-pve] (local build)
Copyright (C) 2002-23, Bruce Allen, Christian Franke, www.smartmontools.org

=== START OF INFORMATION SECTION ===
Model Family:     Samsung based SSDs
Device Model:     SAMSUNG MZ7LM960HMJP-00003
Serial Number:    S3LHNX0J800026
LU WWN Device Id: 5 002538 c40769d69
Firmware Version: GXT50F3Q
User Capacity:    960,197,124,096 bytes [960 GB]
Sector Size:      512 bytes logical/physical
Rotation Rate:    Solid State Device
Form Factor:      2.5 inches
TRIM Command:     Available, deterministic, zeroed
Device is:        In smartctl database 7.3/5528
ATA Version is:   ACS-2, ATA8-ACS T13/1699-D revision 4c
SATA Version is:  SATA 3.1, 6.0 Gb/s (current: 6.0 Gb/s)
Local Time is:    Wed Apr 15 18:45:48 2026 CEST
SMART support is: Available - device has SMART capability.
SMART support is: Enabled

=== START OF READ SMART DATA SECTION ===
SMART overall-health self-assessment test result: PASSED

General SMART Values:
Offline data collection status:  (0x82)	Offline data collection activity
					was completed without error.
					Auto Offline Data Collection: Enabled.
Self-test execution status:      (   0)	The previous self-test routine completed
					without error or no self-test has ever 
					been run.
Total time to complete Offline 
data collection: 		( 3600) seconds.
Offline data collection
capabilities: 			 (0x53) SMART execute Offline immediate.
					Auto Offline data collection on/off support.
					Suspend Offline collection upon new
					command.
					No Offline surface scan supported.
					Self-test supported.
					No Conveyance Self-test supported.
					Selective Self-test supported.
SMART capabilities:            (0x0003)	Saves SMART data before entering
					power-saving mode.
					Supports SMART auto save timer.
Error logging capability:        (0x01)	Error logging supported.
					General Purpose Logging supported.
Short self-test routine 
recommended polling time: 	 (   2) minutes.
Extended self-test routine
recommended polling time: 	 (  60) minutes.
SCT capabilities: 	       (0x003d)	SCT Status supported.
					SCT Error Recovery Control supported.
					SCT Feature Control supported.
					SCT Data Table supported.

SMART Attributes Data Structure revision number: 1
Vendor Specific SMART Attributes with Thresholds:
ID# ATTRIBUTE_NAME          FLAG     VALUE WORST THRESH TYPE      UPDATED  WHEN_FAILED RAW_VALUE
  5 Reallocated_Sector_Ct   0x0033   098   098   010    Pre-fail  Always       -       44
  9 Power_On_Hours          0x0032   085   085   000    Old_age   Always       -       71431
 12 Power_Cycle_Count       0x0032   099   099   000    Old_age   Always       -       25
177 Wear_Leveling_Count     0x0013   091   091   005    Pre-fail  Always       -       626
179 Used_Rsvd_Blk_Cnt_Tot   0x0013   098   098   010    Pre-fail  Always       -       44
180 Unused_Rsvd_Blk_Cnt_Tot 0x0013   098   098   010    Pre-fail  Always       -       3244
181 Program_Fail_Cnt_Total  0x0032   100   100   010    Old_age   Always       -       0
182 Erase_Fail_Count_Total  0x0032   100   100   010    Old_age   Always       -       0
183 Runtime_Bad_Block       0x0013   098   098   010    Pre-fail  Always       -       44
184 End-to-End_Error        0x0033   100   100   097    Pre-fail  Always       -       0
187 Uncorrectable_Error_Cnt 0x0032   099   099   000    Old_age   Always       -       69
190 Airflow_Temperature_Cel 0x0032   066   041   000    Old_age   Always       -       34
194 Temperature_Celsius     0x0022   066   041   000    Old_age   Always       -       34 (Min/Max 20/59)
195 ECC_Error_Rate          0x001a   199   199   000    Old_age   Always       -       69
197 Current_Pending_Sector  0x0032   100   100   000    Old_age   Always       -       0
199 CRC_Error_Count         0x003e   100   100   000    Old_age   Always       -       0
202 Exception_Mode_Status   0x0033   100   100   010    Pre-fail  Always       -       0
235 POR_Recovery_Count      0x0012   099   099   000    Old_age   Always       -       9
241 Total_LBAs_Written      0x0032   099   099   000    Old_age   Always       -       568440627940
242 Total_LBAs_Read         0x0032   099   099   000    Old_age   Always       -       612857216884
243 SATA_Downshift_Ct       0x0032   100   100   000    Old_age   Always       -       0
244 Thermal_Throttle_St     0x0032   100   100   000    Old_age   Always       -       0
245 Timed_Workld_Media_Wear 0x0032   100   100   000    Old_age   Always       -       65535
246 Timed_Workld_RdWr_Ratio 0x0032   100   100   000    Old_age   Always       -       65535
247 Timed_Workld_Timer      0x0032   100   100   000    Old_age   Always       -       65535
251 NAND_Writes             0x0032   100   100   000    Old_age   Always       -       1340448062464

SMART Error Log Version: 1
ATA Error Count: 69 (device log contains only the most recent five errors)
	CR = Command Register [HEX]
	FR = Features Register [HEX]
	SC = Sector Count Register [HEX]
	SN = Sector Number Register [HEX]
	CL = Cylinder Low Register [HEX]
	CH = Cylinder High Register [HEX]
	DH = Device/Head Register [HEX]
	DC = Device Command Register [HEX]
	ER = Error register [HEX]
	ST = Status register [HEX]
Powered_Up_Time is measured from power on, and printed as
DDd+hh:mm:SS.sss where DD=days, hh=hours, mm=minutes,
SS=sec, and sss=millisec. It "wraps" after 49.710 days.

Error 69 occurred at disk power-on lifetime: 56900 hours (2370 days + 20 hours)
  When the command that caused the error occurred, the device was active or idle.

  After command completion occurred, registers were:
  ER ST SC SN CL CH DH
  -- -- -- -- -- -- --
  40 51 00 e0 39 73 40  Error: UNC at LBA = 0x007339e0 = 7551456

  Commands leading to the command that caused the error were:
  CR FR SC SN CL CH DH DC   Powered_Up_Time  Command/Feature_Name
  -- -- -- -- -- -- -- --  ----------------  --------------------
  60 00 00 e0 39 73 40 00      02:13:59.351  READ FPDMA QUEUED
  2f 00 01 10 00 00 40 03      02:13:59.351  READ LOG EXT
  60 00 18 e0 39 73 40 03      02:13:59.351  READ FPDMA QUEUED
  60 80 10 e0 37 73 40 02      02:13:59.351  READ FPDMA QUEUED
  60 00 08 e0 3a 73 40 01      02:13:59.351  READ FPDMA QUEUED

Error 68 occurred at disk power-on lifetime: 56900 hours (2370 days + 20 hours)
  When the command that caused the error occurred, the device was active or idle.

  After command completion occurred, registers were:
  ER ST SC SN CL CH DH
  -- -- -- -- -- -- --
  00 51 01 10 00 00 00  Error:  at LBA = 0x00000010 = 16

  Commands leading to the command that caused the error were:
  CR FR SC SN CL CH DH DC   Powered_Up_Time  Command/Feature_Name
  -- -- -- -- -- -- -- --  ----------------  --------------------
  60 00 18 e0 39 73 00 03      02:13:59.351  READ FPDMA QUEUED
  60 80 10 e0 37 73 00 02      02:13:59.351  READ FPDMA QUEUED
  60 00 08 e0 3a 73 00 01      02:13:59.351  READ FPDMA QUEUED
  60 00 00 e0 38 73 00 00      02:13:59.351  READ FPDMA QUEUED
  2f 00 01 10 00 00 00 04      02:13:59.351  READ LOG EXT

Error 67 occurred at disk power-on lifetime: 56900 hours (2370 days + 20 hours)
  When the command that caused the error occurred, the device was active or idle.

  After command completion occurred, registers were:
  ER ST SC SN CL CH DH
  -- -- -- -- -- -- --
  00 51 01 10 00 00 00  Error:  at LBA = 0x00000010 = 16

  Commands leading to the command that caused the error were:
  CR FR SC SN CL CH DH DC   Powered_Up_Time  Command/Feature_Name
  -- -- -- -- -- -- -- --  ----------------  --------------------
  60 80 20 e0 37 73 00 04      02:13:59.351  READ FPDMA QUEUED
  60 00 18 e0 3a 73 00 03      02:13:59.351  READ FPDMA QUEUED
  60 00 10 e0 38 73 00 02      02:13:59.351  READ FPDMA QUEUED
  60 00 08 e0 39 73 00 01      02:13:59.351  READ FPDMA QUEUED
  60 80 00 60 38 73 00 00      02:13:59.351  READ FPDMA QUEUED

Error 66 occurred at disk power-on lifetime: 56882 hours (2370 days + 2 hours)
  When the command that caused the error occurred, the device was active or idle.

  After command completion occurred, registers were:
  ER ST SC SN CL CH DH
  -- -- -- -- -- -- --
  40 51 00 e0 38 73 40  Error: UNC at LBA = 0x007338e0 = 7551200

  Commands leading to the command that caused the error were:
  CR FR SC SN CL CH DH DC   Powered_Up_Time  Command/Feature_Name
  -- -- -- -- -- -- -- --  ----------------  --------------------
  60 80 00 e0 38 73 40 00      02:12:53.494  READ FPDMA QUEUED
  2f 00 01 10 00 00 40 04      02:12:53.494  READ LOG EXT
  60 80 20 e0 38 73 40 04      02:12:53.494  READ FPDMA QUEUED
  60 80 18 60 3b 73 40 03      02:12:53.494  READ FPDMA QUEUED
  60 80 10 60 3a 73 40 02      02:12:53.494  READ FPDMA QUEUED

Error 65 occurred at disk power-on lifetime: 56882 hours (2370 days + 2 hours)
  When the command that caused the error occurred, the device was active or idle.

  After command completion occurred, registers were:
  ER ST SC SN CL CH DH
  -- -- -- -- -- -- --
  00 51 01 10 00 00 00  Error:  at LBA = 0x00000010 = 16

  Commands leading to the command that caused the error were:
  CR FR SC SN CL CH DH DC   Powered_Up_Time  Command/Feature_Name
  -- -- -- -- -- -- -- --  ----------------  --------------------
  60 80 20 e0 38 73 00 04      02:12:53.494  READ FPDMA QUEUED
  60 80 18 60 3b 73 00 03      02:12:53.494  READ FPDMA QUEUED
  60 80 10 60 3a 73 00 02      02:12:53.494  READ FPDMA QUEUED
  60 00 08 e0 37 73 00 01      02:12:53.494  READ FPDMA QUEUED
  60 80 00 e0 3a 73 00 00      02:12:53.494  READ FPDMA QUEUED

SMART Self-test log structure revision number 1
Num  Test_Description    Status                  Remaining  LifeTime(hours)  LBA_of_first_error
# 1  Short offline       Completed without error       00%      5878         -
# 2  Short offline       Completed without error       00%      5854         -
# 3  Short offline       Completed without error       00%      5830         -
# 4  Short offline       Completed without error       00%      5806         -
# 5  Short offline       Completed without error       00%      5782         -
# 6  Short offline       Completed without error       00%      5758         -
# 7  Short offline       Completed without error       00%      5734         -
# 8  Short offline       Completed without error       00%      5710         -
# 9  Short offline       Completed without error       00%      5686         -
#10  Short offline       Completed without error       00%      5662         -
#11  Short offline       Completed without error       00%      5638         -
#12  Short offline       Completed without error       00%      5614         -
#13  Short offline       Completed without error       00%      5590         -
#14  Short offline       Completed without error       00%      5566         -
#15  Short offline       Completed without error       00%      5542         -
#16  Short offline       Completed without error       00%      5518         -
#17  Short offline       Completed without error       00%      5494         -
#18  Short offline       Completed without error       00%      5447         -
#19  Short offline       Completed without error       00%      5423         -
#20  Short offline       Completed without error       00%      5399         -
#21  Short offline       Completed without error       00%      5375         -

SMART Selective self-test log data structure revision number 1
 SPAN  MIN_LBA  MAX_LBA  CURRENT_TEST_STATUS
    1        0        0  Not_testing
    2        0        0  Not_testing
    3        0        0  Not_testing
    4        0        0  Not_testing
    5        0        0  Not_testing
  255        0    65535  Read_scanning was completed without error
Selective self-test flags (0x0):
  After scanning selected spans, do NOT read-scan remainder of disk.
If Selective self-test is pending on power-up, resume after 0 minute delay.

The above only provides legacy SMART information - try 'smartctl -x' for more

###ENDDEVICE
