smartctl 7.4 2024-10-15 r5620 [x86_64-linux-6.17.4-2-pve] (local build)
Copyright (C) 2002-23, Bruce Allen, Christian Franke, www.smartmontools.org

=== START OF INFORMATION SECTION ===
Model Family:     Samsung based SSDs
Device Model:     SAMSUNG MZ7LM960HMJP-00003
Serial Number:    S3LHNX0J800021
LU WWN Device Id: 5 002538 c40769d64
Firmware Version: GXT50F3Q
User Capacity:    960,197,124,096 bytes [960 GB]
Sector Size:      512 bytes logical/physical
Rotation Rate:    Solid State Device
Form Factor:      2.5 inches
TRIM Command:     Available, deterministic, zeroed
Device is:        In smartctl database 7.3/5528
ATA Version is:   ACS-2, ATA8-ACS T13/1699-D revision 4c
SATA Version is:  SATA 3.1, 6.0 Gb/s (current: 6.0 Gb/s)
Local Time is:    Fri Mar 27 08:16:20 2026 CET
SMART support is: Available - device has SMART capability.
SMART support is: Enabled

=== START OF READ SMART DATA SECTION ===
SMART overall-health self-assessment test result: PASSED

General SMART Values:
Offline data collection status:  (0x82)	Offline data collection activity
					was completed without error.
					Auto Offline Data Collection: Enabled.
Self-test execution status:      (   0)	The previous self-test routine completed
					without error or no self-test has ever 
					been run.
Total time to complete Offline 
data collection: 		( 3600) seconds.
Offline data collection
capabilities: 			 (0x53) SMART execute Offline immediate.
					Auto Offline data collection on/off support.
					Suspend Offline collection upon new
					command.
					No Offline surface scan supported.
					Self-test supported.
					No Conveyance Self-test supported.
					Selective Self-test supported.
SMART capabilities:            (0x0003)	Saves SMART data before entering
					power-saving mode.
					Supports SMART auto save timer.
Error logging capability:        (0x01)	Error logging supported.
					General Purpose Logging supported.
Short self-test routine 
recommended polling time: 	 (   2) minutes.
Extended self-test routine
recommended polling time: 	 (  60) minutes.
SCT capabilities: 	       (0x003d)	SCT Status supported.
					SCT Error Recovery Control supported.
					SCT Feature Control supported.
					SCT Data Table supported.

SMART Attributes Data Structure revision number: 1
Vendor Specific SMART Attributes with Thresholds:
ID# ATTRIBUTE_NAME          FLAG     VALUE WORST THRESH TYPE      UPDATED  WHEN_FAILED RAW_VALUE
  5 Reallocated_Sector_Ct   0x0033   100   100   010    Pre-fail  Always       -       0
  9 Power_On_Hours          0x0032   085   085   000    Old_age   Always       -       70965
 12 Power_Cycle_Count       0x0032   099   099   000    Old_age   Always       -       25
177 Wear_Leveling_Count     0x0013   092   092   005    Pre-fail  Always       -       583
179 Used_Rsvd_Blk_Cnt_Tot   0x0013   100   100   010    Pre-fail  Always       -       0
180 Unused_Rsvd_Blk_Cnt_Tot 0x0013   100   100   010    Pre-fail  Always       -       3301
181 Program_Fail_Cnt_Total  0x0032   100   100   010    Old_age   Always       -       0
182 Erase_Fail_Count_Total  0x0032   100   100   010    Old_age   Always       -       0
183 Runtime_Bad_Block       0x0013   100   100   010    Pre-fail  Always       -       0
184 End-to-End_Error        0x0033   100   100   097    Pre-fail  Always       -       0
187 Uncorrectable_Error_Cnt 0x0032   100   100   000    Old_age   Always       -       0
190 Airflow_Temperature_Cel 0x0032   070   041   000    Old_age   Always       -       30
194 Temperature_Celsius     0x0022   070   041   000    Old_age   Always       -       30 (Min/Max 20/59)
195 ECC_Error_Rate          0x001a   200   200   000    Old_age   Always       -       0
197 Current_Pending_Sector  0x0032   100   100   000    Old_age   Always       -       0
199 CRC_Error_Count         0x003e   100   100   000    Old_age   Always       -       0
202 Exception_Mode_Status   0x0033   100   100   010    Pre-fail  Always       -       0
235 POR_Recovery_Count      0x0012   099   099   000    Old_age   Always       -       9
241 Total_LBAs_Written      0x0032   099   099   000    Old_age   Always       -       504778195589
242 Total_LBAs_Read         0x0032   099   099   000    Old_age   Always       -       630346774249
243 SATA_Downshift_Ct       0x0032   100   100   000    Old_age   Always       -       0
244 Thermal_Throttle_St     0x0032   100   100   000    Old_age   Always       -       0
245 Timed_Workld_Media_Wear 0x0032   100   100   000    Old_age   Always       -       65535
246 Timed_Workld_RdWr_Ratio 0x0032   100   100   000    Old_age   Always       -       65535
247 Timed_Workld_Timer      0x0032   100   100   000    Old_age   Always       -       65535
251 NAND_Writes             0x0032   100   100   000    Old_age   Always       -       1247153657856

SMART Error Log Version: 1
No Errors Logged

SMART Self-test log structure revision number 1
Num  Test_Description    Status                  Remaining  LifeTime(hours)  LBA_of_first_error
# 1  Short offline       Completed without error       00%      5423         -
# 2  Short offline       Completed without error       00%      5399         -
# 3  Short offline       Completed without error       00%      5375         -
# 4  Short offline       Completed without error       00%      5351         -
# 5  Short offline       Completed without error       00%      5327         -
# 6  Short offline       Completed without error       00%      5303         -
# 7  Short offline       Completed without error       00%      5279         -
# 8  Short offline       Completed without error       00%      5255         -
# 9  Short offline       Completed without error       00%      5231         -
#10  Short offline       Completed without error       00%      5207         -
#11  Short offline       Completed without error       00%      5183         -
#12  Short offline       Completed without error       00%      5159         -
#13  Short offline       Completed without error       00%      5135         -
#14  Short offline       Completed without error       00%      5111         -
#15  Short offline       Completed without error       00%      5087         -
#16  Short offline       Completed without error       00%      5063         -
#17  Short offline       Completed without error       00%      5039         -
#18  Short offline       Completed without error       00%      5015         -
#19  Short offline       Completed without error       00%      4991         -
#20  Short offline       Completed without error       00%      4967         -
#21  Short offline       Completed without error       00%      4943         -

SMART Selective self-test log data structure revision number 1
 SPAN  MIN_LBA  MAX_LBA  CURRENT_TEST_STATUS
    1        0        0  Not_testing
    2        0        0  Not_testing
    3        0        0  Not_testing
    4        0        0  Not_testing
    5        0        0  Not_testing
  255        0    65535  Read_scanning was completed without error
Selective self-test flags (0x0):
  After scanning selected spans, do NOT read-scan remainder of disk.
If Selective self-test is pending on power-up, resume after 0 minute delay.

The above only provides legacy SMART information - try 'smartctl -x' for more
